quality_tier,quality_score,discovery_source,registry_journal,title,year,doi,url,rights_class,authority_rank,topics,dossier_use_buckets,citation_count,abstract
A,11,crossref,Aesthetic Medicine,The author’s Timeless protocol: biostimulating peptides and picosecond alexandrite laser as an innovative approach to cellular rejuvenation,2025,10.17116/plast.hirurgia202501180,https://doi.org/10.17116/plast.hirurgia202501180,unknown,4,lasers_energy_devices; rf_microneedling_ultrasound; skin_quality_peels,clinical_gateway_source; safety_floor; sales_education_support; combination_observation; structured_taxonomy_support,0,"Objective. To estimate the effectiveness and safety of mesotherapeutic cocktail with peptides, picosecond laser and skin care products containing peptides for increasing skin elasticity, firmness and quality. Material and methods. At the first stage, 15 patients received injections of peptide-based mesotherapeutic cocktail and picosecond laser procedure at the same day. Moreover, they used skin care products with peptides within a month. Results were followed-up using photography and Global Aesthetic Improvement Scale (GAIS). At the second stage, umbilical region in 3 patients was divided into 5 areas for different procedures: area I — combination of 3 methods, area II — laser exposure alone, area III — mesotherapy alone, area IV — skin care alone, area V — control. Objective control implied ultrasound and histological examination of skin in each area. Results. After the first stage, macroscopic photographs revealed significantly better skin texture, smoothing of fine wrinkles, homogenization of color and reduction of hyperpigmentation. About 93.3% of patients and 93.3% of doctors presented the most positive opinion about treatment outcomes, and all respondents were satisfied with overall results. At the second stage, area I had significant dermis thickening, homogeneity and epidermis compaction, as well as slightly higher echogenicity compared to the control one. Histological examination revealed more intense collagen renewal process in areas I, II and III. Combined method of exposure was the most effective, while skin care products alone showed no significant effect. Conclusion. Combined techniques demonstrated effectiveness and safety. Indeed, this protocol can improve soft tissues of the face, neck and decollete, reduce fine lines and pigment spots."
A,11,openalex,Aesthetic Plastic Surgery,"A BERT-Based Empirical Analysis of Medical Aesthetic Health Risks — A Study on the ""Rednote"" Platform",2025,10.1145/3759972.3760173,https://doi.org/10.1145/3759972.3760173,open_access_cc_by,2,lasers_energy_devices; skin_quality_peels,clinical_gateway_source; combination_observation; structured_taxonomy_support,0,"In this study, we investigated consumers' views on and potential health risks of four popular aesthetic plastic surgeries on the Rednote platform: Photorejuvenation, Picosecond Laser Treatment, Facial Slimming Injection, and Hydrodermabrasion Injection. Through systematic data collection and analysis, a comprehensive framework has been developed that enhances content assessment by combining various deep learning methods. Our method integrates three neural network architectures, text-CNN, DPCNN and TextRNN, to carry out fine-grained sensitivity analysis, and classifies user feedback into three categories: positive, neutral and negative. These multi-model methods capture localized patterns and sequential dependencies in the user-generated content. The study further established two levels of risk assessment system. After initial characteristic extraction and risk indication under expert guidance, conduct predictive analysis with professional classifier based on BERT. This dual analysis effectively identifies potential health issues in consumer discussions. The model shows an effective ability to detect different types of risk information and provides useful support for consumer awareness and platform security measures."
A,11,openalex,Aesthetic Plastic Surgery,"A prospective, comparative evaluation of axillary hair removal with an 808-nm diode laser at different fluences",2019,10.14730/aaps.2019.01599,https://doi.org/10.14730/aaps.2019.01599,open_access_cc_by,2,lasers_energy_devices,clinical_gateway_source; sales_education_support; timing_maintenance,1,"Background Diode lasers are the gold standard for removing unwanted hair. Lowering the energy should result in less pain and could theoretically affect therapeutic efficacy. This study evaluated the efficacy of an 808-nm diode laser at different fluences for permanent axillary hair removal in Korean women. Methods Twenty-four Korean women were divided into two groups. Each patient received laser treatment at both axillae, which were divided into upper and lower parts. Each part received different fluence from an HR808 prototype diode at 1-month intervals: 8, 10, 12, and 14 J/cm2. Hair count and thickness were recorded at each follow-up visit and at a 3-month follow-up after the final laser treatment by photography and using a folliscope. At the final visit, pain and patient satisfaction were surveyed. Three plastic surgeons assessed the results on photographs. Results The mean hair follicle density reduction was 62.18%, 65.28%, 73.08%, and 78.29% on the right upper side, right lower side, left upper side, and left lower side, respectively. The mean hair follicle thickness reduction was 45%, 48%, 54%, and 59% on the right upper side, right lower side, left upper side, and left lower side, respectively. In the plastic surgeons’ assessment, the left upper and lower sides scored 2.71. The right upper and lower sides scored 2.38 and 2.04, respectively. Conclusions High-fluence (14 J/cm2) treatment with an HR 808 prototype diode laser efficiently removed unwanted hair. No significant difference in comfort was reported compared to the low-fluence mode (8–10 J/cm2)."
A,11,openalex,Aesthetic Plastic Surgery,Botulinum Toxin Type A for Treatment of Masseter Hypertrophy: Volumetric Analysis of Masseter Muscle Reduction over Time,2016,10.14730/aaps.2016.22.2.79,https://doi.org/10.14730/aaps.2016.22.2.79,open_access_cc_by,2,injectables_neurotoxins,clinical_gateway_source; combination_observation; timing_maintenance; structured_taxonomy_support,4,"Background There has been increasing interest in facial contouring procedures throug hout Asian countries. As such, botulinum toxin A injections for masseteric hypertrophy have become a common procedure provided to patients who desire nonsurgical cor rection of a squareangled mandible. We published a retrospective review of our initial results and our technique and treatment protocol in 2005. We also completed a long term followup of the results (average followup period of 4.28 years) and the efficacy of repeated injections in 2010. The purpose of the current study is to systematically evaluate the changes to the masseter muscle at weekly intervals to determine the physiologic effects of botulinum toxin A injection. Methods Eight patients were prospectively followed on a weekly basis after botulinum toxin A injection for masseteric hypertrophy. Eight patients were followed for 15 weeks and four patients were followed for 25 weeks. Changes in the thickness of the muscle were recorded and analyzed. Results A reduction in the muscle thickness was found during the clenching phase of the muscle in the first week followed by a reduction in thickness during the resting phase in the second week. The reduction in muscle thickness continued until the elev enth week after which there was a gradual, but incomplete, return of muscle thickness over the study period. Conclusions There is a predictable, phasic reduction in muscle thickness after botuli num toxin A injection for masseteric hypertrophy. This reduction first occurs during the clenching phase followed by a concomitant reduction during the resting phase. Maxi mal size reduction occurs at 11 weeks followed by gradual muscle size recovery."
A,11,openalex,Aesthetic Plastic Surgery,Changing Aesthetic Surgery Interest in Men: An 18-Year Analysis,2023,10.1007/s00266-023-03344-9,https://doi.org/10.1007/s00266-023-03344-9,open_access_cc_by,2,dermal_fillers; rf_microneedling_ultrasound; skin_quality_peels,clinical_gateway_source; structured_taxonomy_support,25,"Abstract Background Historically, men have been shamed if they cared seemingly too much about their appearance and especially, if they pursued aesthetic surgery. However, due to the changing landscape of the culture, this stigma has seemed to decrease. Men have diverse and quickly changing interests in particular procedures that have not been readily explored in the currently available reports. To examine this, we analyzed interest in specific plastic surgery procedures in men over the last two decades using the Google Trends tool. Methods The most common cosmetic procedures were chosen from the American Society of Plastic Surgeons website and served as the search terms for the Google Trends tool from 2004 to 2021. All 19 procedures were examined for overall trends and for changes in the last decade through comparing the data in bisected time periods. Results Interest in all plastic surgery procedures in men increased since 2004 except for breast reduction. Most notably, jawline filler, Botox, microneedling, lip filler, chemical peel, CoolSculpting, and butt lift had the largest trend increases. In the last decade, all procedures showed a significant increase in interest. Conclusions While surgical volume data are valuable, our study shows that Google Trends is a beneficial tool to predict quickly changing and specific trends, especially as the patient population of plastic surgery grows with increased diversity and generational changes. Our study shows that there is an increase in male-centered plastic surgery procedures, especially nonsurgical facial procedures. Male interest in plastic surgery will continue to increase with time. Level of Evidence IV This journal requires that authors assign a level of evidence to each article. For a full description of these Evidence-Based Medicine ratings, please refer to the Table of Contents or the online Instructions to Authors www.springer.com/00266 ."
A,11,crossref,Aesthetic Plastic Surgery,Comparison of the efficacy and safety between a new monophasic hyaluronic acid filler and a biphasic hyaluronic acid filler in correcting facial wrinkles,2023,10.14730/aaps.2023.00836,https://doi.org/10.14730/aaps.2023.00836,unknown,2,dermal_fillers,clinical_gateway_source; safety_floor; sales_education_support; timing_maintenance; structured_taxonomy_support,0,"Background The longstanding and common use of hyaluronic acid (HA) has driven the expanded development of various commercial HA fillers. However, differences in the components of these HA fillers lead to variations in their effect. We compared the <i>in vivo</i> safety and efficacy of biphasic HA (BHA) and a new monophasic HA (MHA) for improving facial wrinkles. We investigated differences in outcomes after their injection into nasolabial folds (NLFs) using the Wrinkle Severity Rating Scale (WSRS), patient satisfaction using the Global Aesthetic Improvement Scale (GAIS), and pain using a visual analog scale (VAS). We also performed a safety assessment of the two fillers.Methods This matched-pair, double-blind, randomized study compared the degree of temporal wrinkle improvement in the NLFs of 91 participants using the BHA filler versus the new MHA filler. Safety and efficacy were compared at 8 and 24 weeks.Results At 24 weeks after application, the average WSRS scores were 2.17±0.72 (BHA) and 2.07±0.71 (MHA) (P=0.034). The average GAIS scores, as measured by a treating investigator at 8 weeks and 24 weeks, were 0.94±0.76 (BHA) and 0.98±0.78 (MHA) at 8 weeks (P=0.181), and 0.44±0.64 (BHA) and 0.49±0.69 (MHA) at 24 weeks (P=0.103). The VAS pain score was 0 points at 30 minutes after filler application in both groups.Conclusions Both the BHA filler and the new MHA filler were safe and effective for improving facial wrinkles in NLFs, but the new MHA filler was more effective for the cosmetic improvement of wrinkle severity than the BHA filler."
A,11,openalex,Aesthetic Plastic Surgery,"Concentric Malar Lift in the Management of Lower Eyelid Rejuvenation or Retraction: A Clinical Retrospective Study on 342 Cases, 13 Years After the First Publication",2018,10.1007/s00266-018-1079-0,https://doi.org/10.1007/s00266-018-1079-0,open_access_cc_by,2,skin_quality_peels,clinical_gateway_source; timing_maintenance,23,"BACKGROUND: Lower eyelid rejuvenation can, unfortunately, induce scleral show even if the lower eyelid procedure is limited. This study was designed to assess the effectiveness and reliability of the concentric malar lift technique in two scenarios: the first, in rejuvenation of the mid-face and, the second, in reconstructive surgery for correction of congenital or acquired eyelids malposition. METHODS: The concentric malar lift technique was first published by Le Louarn (Aesthet Plast Surg 28(6):359-372, 2004). This retrospective study was carried out by analyzing data on patients operated on between January 2010 and January 2016. Patients operated on before 2010 were excluded because barbed thread sutures were not used in the first version of the technique. Patients after January 2016 were excluded to ensure adequate follow-up, and so 342 patients are included in the study. A total of 256 cases (75%) were for aesthetic mid-face lifting, and 86 cases (25%) were reconstructive surgeries for lower eyelid retraction. A spacer graft was used in 30 of these reconstructive cases (35%). The mean follow-up time was 13.6 months. All the concentric malar lifting procedures included strengthening the lateral canthus, which is a key element of the procedure. RESULTS: None of the patients developed secondary eyelid malposition, and all the cases of lower eyelid retraction displayed marked improvement both functionally and aesthetically. Two patients experienced loss of sensitivity of part in the infra-orbital nerve distribution for 4 months after the procedure. CONCLUSION: The concentric malar lift procedure enables the recruitment of a significant amount of skin into the lower eyelid: between 10 and 30 mm. It ensures better rejuvenation of the mid-face with minimal risk of lower eyelid malposition. In reconstruction of the lower eyelid lid, the concentric malar lift is able to reduce the need for skin grafting and a skin flap reducing the risks of visible scarring. LEVEL OF EVIDENCE IV: This journal requires that authors assign a level of evidence to each article. For a full description of these Evidence-Based Medicine ratings, please refer to the Table of Contents or the online Instructions to Authors www.springer.com/00266 ."
A,11,openalex,Aesthetic Plastic Surgery,Correction of Dark Coloration of the Lower Eyelid Skin with Nanofat Grafting,2014,10.14730/aaps.2014.20.2.92,https://doi.org/10.14730/aaps.2014.20.2.92,open_access_cc_by,2,skin_quality_peels,safety_floor; structured_taxonomy_support,20,"nanofat' grafting and introduced its characteristics and clinical applications. The authors used their nanofat grafting to correct lower eyelid dark circles. Methods Nanofat grafting was performed in 19 patients for dark lower eyelids. The grafts were injected into subdermal layer using blunt cannula. Microfat grafting with nasojugal fold was performed to all the patients. Among them, 18 patients received transconjunctival fat removal at the same time. Results All the patients showed much improvement from preoperative dark coloration. There were no visible lumps of fat, contour irregularities, or fat necrosis. Postoperative edema and ecchymosis were minimal. Conclusions Nanofat grafting methods provide a good alternative for correcting dark circles by augmenting thin skin with lower complications. This simple, cost effective procedure is suitable for correction of dark circles and various skin rejuvenation purposes."
A,11,crossref,Aesthetic Plastic Surgery,Effectiveness of Radiofrequency Microneedling in the Treatment of Dermatological Conditions: A Systematic Review,2026,10.1007/s00266-026-05834-y,https://doi.org/10.1007/s00266-026-05834-y,unknown,2,injectables_neurotoxins; lasers_energy_devices; rf_microneedling_ultrasound; skin_quality_peels,clinical_gateway_source; safety_floor; sales_education_support; timing_maintenance; structured_taxonomy_support,0,"Abstract Background Radiofrequency microneedling (RFMN) utilizes RF energy delivered via needles to the dermis to enhance texture, reduce laxity, and improve dyschromia. However, evidence has been fragmented by indication/device heterogeneity. We evaluated clinical effectiveness, safety, and patient-reported outcomes (PROs) of RFMN across dermatological conditions. Methods Searches of PubMed, Google Scholar, and Semantic Scholar (January 2015–July 2025) (PROSPERO registration: CRD420251089393) were conducted, and English-language RCTs, cohort studies, case series, and reports of RFMN across skin indications were included (non-human studies excluded). A modified Critical Appraisal Skills Programme (CASP) checklist was used for quality analysis. Findings were narratively synthesized. Results Forty-one studies met the criteria (15 RCTs, 19 prospective non-randomized studies, 5 prospective cohorts, 2 case series) spanning diverse geographies and Fitzpatrick skin types. For atrophic acne scars, RFMN consistently reduced scar scores and demonstrated efficacy comparable to fractional lasers. For skin laxity/photoaging, RFMN improved wrinkle scales, dermal density, and submental volume, (histologically evidenced). Additional benefits were noted for rosacea, melasma, and striae, though effect sizes varied. In primary axillary hyperhidrosis, botulinum toxin A outperformed RFMN for symptom reduction/comfort. Safety was favorable; erythema, edema, and transient pain predominated; post-inflammatory hyperpigmentation was infrequent and self-limited. PROs indicated high satisfaction and minimal downtime. Reporting of technical parameters, especially temperature, pulse width, and cooling, was inconsistent. Conclusions RFMN is safe, well-tolerated, with credible efficacy across multiple indications and skin types, and an attractive recovery profile. Standardized outcomes, longer follow-up periods, and rigorous reporting of device settings are necessary to refine protocols and facilitate head-to-head device comparisons. Level of Evidence III This journal requires that authors assign a level of evidence to each article. For a full description of these evidence-based medicine ratings, please refer to the Table of Contents or the online Instructions to Authors www.springer.com/00266 ."
A,11,openalex,Aesthetic Plastic Surgery,Efficacy of a long-pulsed 1064-nm Nd:YAG laser in acute scar redness,2023,10.14730/aaps.2023.00843,https://doi.org/10.14730/aaps.2023.00843,open_access_cc_by,2,lasers_energy_devices,clinical_gateway_source; sales_education_support; timing_maintenance,2,"Background The initial redness of the scar on a postoperative suture site is a natural phenomenon that fades over time. However, with a long period of redness, patients complain about cosmetic discomfort, and the possibility of pigmentation changes is induced. We investigated the use of a long-pulsed 1064 nm Nd:YAG laser as a noninvasive treatment for improving the redness of these scars.Methods A retrospective chart review was conducted on 36 patients who underwent excision of a nevus on the face. Fourteen patients received laser treatment and another 22 patients used only scar management ointment. Patients were followed up 1 week after the sutures were removed. The photographic images taken at the time of suture removal and 2 months later were reviewed. The evaluation was performed on a 7-point scale by adding the Japan Scar Workshop (JSW) scar scale’s redness and erythema scores.Results The average initial JSW scar scale score of the treatment group was 4.6, and that of the nontreatment group was 4.2. When the re-evaluation was performed 2 months later, the score of the treatment group decreased to 2.2 and that of the nontreatment group decreased to 3.1. The difference in the JSW scar scale between the treatment group and the nontreatment group according to laser performance was statistically significant (P=0.03).Conclusions The treatment method with a long-pulsed 1064 nm Nd:YAG laser that is less invasive and has a quick effect can be a good alternative for improving this initial scar redness."
A,11,openalex,Aesthetic Plastic Surgery,The Ideals of Facial Beauty Among Chinese Aesthetic Practitioners: Results from a Large National Survey,2018,10.1007/s00266-018-1241-8,https://doi.org/10.1007/s00266-018-1241-8,open_access_cc_by,2,injectables_neurotoxins; medspa_general,clinical_gateway_source; structured_taxonomy_support,38,"As the demand for cosmetic procedures increases, the importance of patient-centred care in this field becomes more prominent. The aesthetic practitioners' ideals of beauty, in addition to their knowledge and perception of patients' ideals of beauty and expectations, are important during doctor-patient communication. These are important in strengthening practices of patient-centred communication and treatment. This study was conducted to investigate ideals of facial beauty among Chinese aesthetic practitioners. A questionnaire with simple sketches of facial features was given to aesthetic practitioners in Chinese cosmetology hospitals and clinics to assess aesthetic practitioners' ideals of beauty and their preferences for facial shapes, facial profile, nose and lip shape, jaw angle, and chin shape. A total of 596 surveys were completed. This survey revealed that Chinese aesthetic practitioners preferred a heart/inverted triangular facial shape with a reduced lower face height, a straight and small nose, as well as lips that are full medially and taper off laterally with well-defined borders and Cupid's bow. An obtuse jaw angle for women and a square well-defined jaw angle for men, and a round and pointy chin for both women and men were the most preferred. A majority (66.7%) of the respondents said they would have plastic surgery. However, if given the choice 82.9% indicated they would opt for non-surgical procedures. Finally, a clear majority (90.5%) believed that being beautiful would improve their daily life. The results were then compared to a similar previous study in which the same ideals of beauty were investigated among Chinese laypersons. This information will help the aesthetic professionals to understand their patient's requests and expectations better and therefore aid in offering and providing treatments that are in line. LEVEL OF EVIDENCE V: This journal requires that authors assign a level of evidence to each article. For a full description of these Evidence-Based Medicine ratings, please refer to the Table of Contents or the online Instructions to Authors www.springer.com/00266 ."
A,11,crossref,Aesthetic Surgery Journal Open Forum,Commentary on: A Multicenter Evaluation of Paradoxical Adipose Hyperplasia Following Cryolipolysis for Fat Reduction and Body Contouring: A Review of 8658 Cycles in 2114 Patients,2021,10.1093/asj/sjab219,https://doi.org/10.1093/asj/sjab219,open_access_cc_by,2,body_contouring,clinical_gateway_source; safety_floor,1,
A,11,crossref,Aesthetic Surgery Journal Open Forum,Commentary on: Characteristics and Treatment of Patients Diagnosed With Paradoxical Adipose Hyperplasia After Cryolipolysis: A Case Series and Scoping Review,2022,10.1093/asj/sjac218,https://doi.org/10.1093/asj/sjac218,open_access_cc_by,2,body_contouring,clinical_gateway_source; safety_floor,0,
A,11,crossref,Aesthetic Surgery Journal Open Forum,"Cryolipolysis: A Reconsideration of Efficacy, Safety, and the Risk of Paradoxical Adipose Hyperplasia",2023,10.1093/asj/sjac255,https://doi.org/10.1093/asj/sjac255,open_access_cc_by,2,body_contouring,clinical_gateway_source; safety_floor,5,
