quality_tier,quality_score,discovery_source,registry_journal,title,year,doi,url,rights_class,authority_rank,topics,dossier_use_buckets,citation_count,abstract
A,15,crossref,Aesthetic Surgery Journal Open Forum,A Multicenter Evaluation of Paradoxical Adipose Hyperplasia Following Cryolipolysis for Fat Reduction and Body Contouring: A Review of 8658 Cycles in 2114 Patients,2021,10.1093/asj/sjaa310,https://doi.org/10.1093/asj/sjaa310,open_access_cc_by,2,body_contouring,clinical_gateway_source; safety_floor; sales_education_support; combination_observation,36,"Abstract Background Paradoxical adipose hyperplasia (PAH) is a rare, moderate-to-severe adverse event associated with cryolipolysis (CoolSculpting, CS). Objectives The aim of this study was to describe the incidence, diagnosis, and treatment of PAH occurring after CS for nonsurgical fat reduction. Methods A multicenter evaluation of all patients who underwent CS treatment between January 2015 and December 2019 at 8 Canadian medical centers was conducted. Data abstracted included symptoms, management strategy, outcome, operator characteristics, device characteristics, patient characteristics, body region, and CS treatment details. Incidence of PAH was calculated based on the number of treatment cycles. Results Our findings revealed incidence rates between 0.05% and 0.39%, which are slightly higher than the manufacturer’s quoted rate of 0.025% (1 per 4000 cycles). Incidence rates at all sites were dramatically reduced by over 75% with the implementation of newer models of CS units. Of patients who developed PAH, 55% were male and 77.8% were of European ethnic origin. The majority of cases (76.9%) were associated with older models of CS units. Conclusions Development of PAH may be related to a combination of factors, including older models of CS units and applicators, as well as individual characteristics that predispose certain patients. Level of Evidence: 4"
A,15,crossref,Aesthetic Surgery Journal Open Forum,Autogenous Fat Transplantation and Botulinum Toxin Injection Into the Masseter Muscle to Create an Ideal Oval Face,2021,10.1093/asj/sjaa324,https://doi.org/10.1093/asj/sjaa324,open_access_cc_by,2,injectables_neurotoxins,clinical_gateway_source; safety_floor; sales_education_support; combination_observation; timing_maintenance; structured_taxonomy_support,12,"Abstract Background East Asian faces vary in shape but only oval faces seem to be considered attractive. Many patients with wide faces seek removal of part of the mandibular angle and/or zygoma to achieve an ideal facial contour, but the procedure is high risk and the recovery period is relatively protracted. Objectives We sought to achieve ideal facial contours through the use of autologous fat grafting (AFG) combined with masseter botulinum toxin (BTX) injection for patients with wide faces and masseter hypertrophy. Methods Fourteen patients with wide faces underwent AFG of the forehead, temporal region, cheeks, zygomatic body, nose, nasolabial fold, tear trough, and chin; and BTX injection into the masseter muscles. Each patient was photographed more than 6 months after the operation. The pre- and postoperative ratios pertaining to the facial aesthetics of the face were calculated. The Hollowness Severity Rating Scale (HSRS) and Ricketts’s E-line were used to evaluate the photographs. Patient satisfaction was also investigated. Results All patients received AFG and 1 to 3 BTX injections. The face length:bizygomatic breadth, bigonial breadth:bizygomatic breadth, and lower-face height:middle-face height ratios improved greatly after treatment. The mean HSRS score decreased from 2.214 preoperatively to 1.071 postoperatively. The chin and nose became more prominent than before. Facial swelling persisted for an average of 11.929 days. All patients were satisfied with the treatment outcome. Conclusions A combination of AFG and BTX injection was able to achieve an ideal oval face in East Asian patients with wide faces and masseter hypertrophy, with very few complications. Recovery was rapid and patient satisfaction was high. Level of Evidence: 4"
A,15,crossref,Aesthetic Surgery Journal Open Forum,"Radiofrequency Microneedling: Technology, Devices, and Indications in the Modern Plastic Surgery Practice",2023,10.1093/asjof/ojad100,https://doi.org/10.1093/asjof/ojad100,open_access_cc_by,2,rf_microneedling_ultrasound,clinical_gateway_source; safety_floor; sales_education_support; combination_observation; structured_taxonomy_support,17,"Abstract Background Since the initial invention of microneedling, advancements have been made to improve the desired effects. The addition of radiofrequency to microneedling devices was developed within the past decade as a way to induce thermal injury and increase dermal heating to enhance the dermal wound healing cascade. Objectives With an overabundance of literature and mainstream media focused on microneedling and radiofrequency microneedling, this review aims to focus on the available high-quality evidence. Methods A comprehensive review of the literature was performed across PubMed (National Institutes of Health, Bethesda, MD) and Embase (Elsevier, Amsterdam, the Netherlands) databases. Attention was focused on manuscripts that provided objective data with respect to clinical application, innovation, anatomy, and physiology. Results Optimal outcomes are achieved when needle depth is targeted to the reticular dermis. Needle depth should reflect the relative differences in epidermal and dermal thickness throughout the face. A depth of at least 1.5 mm should be used for the forehead and temporal skin, 1.0 mm for the malar region, 2.0 mm (maximum depth for radiofrequency microneedling) for the nasal side walls, 0.5 mm for the perioral skin, and 1.5 mm for the neck. Deeper settings can be used with care to provide some fat reduction in the submentum. Conclusions The authors find herein that radiofrequency microneedling is a safe adjunctive tool to surgical aesthetic procedures. The addition of radiofrequency poses an advance over traditional microneedling devices for skin tightening, with improvements in both safety and efficacy over time. Level of Evidence: 5"
A,14,openalex,Aesthetic Plastic Surgery,Facial Contouring by Using Dermal Fillers and Botulinum Toxin A: A Practical Approach,2019,10.1007/s00266-019-01361-1,https://doi.org/10.1007/s00266-019-01361-1,open_access_cc_by,2,dermal_fillers; injectables_neurotoxins,clinical_gateway_source; safety_floor; sales_education_support; timing_maintenance; structured_taxonomy_support,38,"BACKGROUND: The perception of an attractive face is largely subjective. The purpose of this paper is to provide an insight and a practical approach to facial contouring management with hyaluronic acid (HA) implants and botulinum toxin A. METHODS: This study is presenting the clinical experience of the authors regarding facial contouring. After a careful medical history, patients underwent an exhaustive aesthetic assessment that includes photographs and videos. Realistic treatment goals were discussed and agreed with the patient. Comprehensive treatment strategies for facial contouring, including HA implants and/or botulinum toxin A injections, were selected according to the patient needs. RESULTS: , developed by Mauricio de Maio, these treatment strategies have been adapted to six different basic categories of facial shapes, namely round, square, triangular, inverted triangle, rectangle, oval and oblong faces. The incidence of complications was low and, in all the cases, was mild (edema, erythema and local ecchymosis), of limited duration, and was resolved without sequela. CONCLUSIONS: The current article presented the personal experiences of the authors on a specific subject, and this fact should be considered when interpreting data from this paper. As other aesthetic treatments, facial contouring should be focused on the patient needs and to select a specific aesthetic approach according to different facial shapes. Finally, it is essential to have a good understanding of the potential associated complications, because it will help the specialist to take the necessary precautions to prevent them, and if they ever arise, to be able to deal with them effectively. LEVEL OF EVIDENCE IV: This journal requires that authors assign a level of evidence to each article. For a full description of these Evidence-Based Medicine ratings, please refer to the Table of Contents or the online Instructions to Authors www.springer.com/00266 ."
A,14,crossref,Aesthetic Surgery Journal Open Forum,Body Contouring Finesse: Dynamic Definition Liposculpture and Bipolar Radiofrequency Microneedling,2025,10.1093/asj/sjae152,https://doi.org/10.1093/asj/sjae152,open_access_cc_by,2,body_contouring; rf_microneedling_ultrasound,clinical_gateway_source; safety_floor; sales_education_support; combination_observation; structured_taxonomy_support,0,"Abstract Dynamic definition liposculpture (HD2) is considered a highly sought after procedure in body sculpting surgery by patients. Radiofrequency microneedling is a cutting edge technology with evidence-based outcomes demonstrating skin tightening and retraction. These ancillary procedures complement and enhance the results of dynamic definition liposculpture. A retrospective review of patient records from 2022 to 2024 was conducted. All patients who underwent high definition (HD) or HD2 in combination with fractional radiofrequency microneedling treatments by the senior author (A.E.H.) were included. Data collected included patient demographics, areas treated, and any complications. A total of 86 patients were included: 16 in 2022, 62 in 2023, and 8 in 2024. The most frequently treated area was the abdomen, followed by the back, face, neck, thighs, and arms. The average age of patients was 40.0 years in 2022, 40.8 years in 2023, and 44.4 years in 2024. The average BMI was 23.9 kg/m2 in 2022, 24.3 kg/m2 in 2023, and 25.2 kg/m2 in 2024. Minimal complications were observed, with some patients requiring further interventions such as scar correction and nevus resection. Avoiding superficial liposuction by relying on radiofrequency microneedling to target the adipose tissue directly beneath the dermis decreases the risk for iatrogenic (cannula related) superficial contour irregularities and makes the overall operation safer and more reliable."
A,14,openalex,JPRAS Open,Impact of nutrition on skin wound healing and aesthetic outcomes: A comprehensive narrative review,2024,10.1016/j.jpra.2024.01.006,https://doi.org/10.1016/j.jpra.2024.01.006,open_access_cc_by,2,dermal_fillers; medspa_general,clinical_gateway_source; safety_floor; sales_education_support,93,"While current wound treatment strategies often focus on antimicrobials and topical agents, the role of nutrition in wound healing and aesthetic outcomes is crucial but frequently overlooked. This review assesses the impact of specific nutrients and preoperative nutritional status on surgical outcomes. A comprehensive search was conducted in PubMed, Scopus, Web of Science, and the Cochrane Library, spanning from inception to October 2023. The study focused on the influence of macronutrients and micronutrients on aesthetic outcomes, the optimization of preoperative nutritional status, and the association between nutritional status and postoperative complications. Inclusion criteria were English-language, peer-reviewed articles, systematic reviews, meta-analyses, and clinical trials related to nutrition's impact on skin wound healing and aesthetic outcomes. Exclusion criteria included non-English publications, non-peer-reviewed articles, opinion pieces, and animal studies. Omega-3 fatty acids and specific amino acids were linked to enhanced wound healing and immune function. Vitamins A, B, C, and zinc positively influenced healing stages, while vitamin E results were variable. Polyphenolic compounds showed anti-inflammatory effects beneficial for recovery. Malnutrition was associated with increased postoperative complications and infections, whereas preoperative nutritional support correlated with reduced hospital stays and complications. Personalized nutritional plans are essential in surgical care, particularly for Enhanced Recovery After Surgery protocols. Despite the demonstrated benefits of certain nutrients, gaps in research, particularly regarding elements like iron, necessitate further studies. Nutritional assessments and interventions are vital for optimal preoperative care, underscoring the need for more comprehensive guidelines and research in nutritional management for surgical patients."
A,13,openalex,Aesthetic Medicine,"A Multimodal Approach to Facial Rejuvenation—Integrating HA Fillers, Collagen Stimulators, Botulinum Toxin and Energy-Based Devices for Optimal Patient Outcomes",2026,10.3390/jaestheticmed2010003,https://doi.org/10.3390/jaestheticmed2010003,open_access_cc_by,4,dermal_fillers; injectables_neurotoxins; lasers_energy_devices; regenerative_prp; rf_microneedling_ultrasound; skin_quality_peels,clinical_gateway_source; safety_floor; sales_education_support; combination_observation; timing_maintenance,0,"Facial aging is not a singular phenomenon but a cascade of anatomical and biological transformations unfolding across the skeleton, fat, ligaments, muscles, dermis, and epidermis. Its clinical expression-volume loss, sagging, wrinkling, and surface irregularities-cannot be adequately explained by simplistic metaphors of “filling” or “lifting.” This article is a narrative review synthesizing current anatomical, physiological, and clinical evidence relevant to multimodal facial rejuvenation. Traditional monotherapies, while sometimes effective in isolation, are increasingly inadequate for contemporary patients who demand outcomes that are natural, harmonious, and durable. Modern esthetic practice has therefore shifted toward multimodal approaches that address aging across multiple planes. Hyaluronic acid (HA) fillers provide volumetric scaffolding and hydration; collagen stimulators such as poly-L-lactic acid (PLLA) and calcium hydroxylapatite (CaHA) induce neocollagenesis and long-term dermal remodeling; botulinum toxin restores balance to muscular vectors and improves expression dynamics; while energy-based devices (EBDs), including fractional lasers, radiofrequency microneedling, and high-intensity focused ultrasound (HIFU), enhance skin texture, tone, and elasticity. When applied in a sequenced and evidence-based manner, these modalities act synergistically to deliver results unattainable by any single intervention. In addition to established modalities, the field has recently witnessed aggressive promotion of “regenerative” therapies-growth factors, exosomes, platelet-rich plasma (PRP), and platelet-rich fibrin (PRF). While biologically plausible, their efficacy and safety remain uncertain due to the absence of robust, randomized clinical trials and the heterogeneity of current data. This raises a critical question: is aesthetic medicine advancing through science, or being driven by novelty and marketing? This review synthesizes current anatomical and physiological knowledge of aging, evaluates the mechanisms, clinical applications, and safety considerations of major treatment modalities, and proposes practical sequencing strategies. It also emphasizes the ethical imperative that aesthetic medicine, while innovative and fast-evolving, must remain anchored in scientific evidence and patient safety—because aesthetic medicine is, fundamentally, still medicine."
A,13,openalex,Aesthetic Medicine,Rib removal in body contouring surgery and its influence on the waist,2022,10.47511/sapsj.v3.8144,https://doi.org/10.47511/sapsj.v3.8144,open_access_cc_by,4,body_contouring,clinical_gateway_source; safety_floor; combination_observation,27,"Objective: While modern cosmetic surgery allows patients to be offered less invasive and bloody procedures than before, there are cases where these are not sufficient to give the results that meet patients’ expectations, especially in the case of the upper region of the abdomen. The purpose of this study is to describe the 11th and 12th rib removal technique as body contouring surgery in patients for whom traditional surgery would not have reached the desired results. Materials and methods: A case series study is presented, describing the surgical records of patients who underwent 11th and 12th rib removal for aesthetic purposes, with or without other elective cosmetic surgeries. Results: A total of 104 women who underwent costal resection surgeries during a period of 8 years were identified. Only 10 of these patients underwent rib removal exclusively, being the most common combination of procedures liposuction and rib removal. The average age was 29, 39 at the time of surgery, and two pneumothorax were the only transoperative complications presented. Conclusions: The 11th and 12th rib removal is a not-gory technique with a low complication rate."
A,13,openalex,Aesthetic Plastic Surgery,A Primer on Abdominoplasty Safety,2024,10.1177/22925503241300335,https://doi.org/10.1177/22925503241300335,open_access_cc_by,2,body_contouring; medspa_general,clinical_gateway_source; safety_floor; sales_education_support; structured_taxonomy_support,4,"Background: Abdominoplasty continues to be a frequently performed plastic surgery procedure. Futhermore, an increase in both surgical and medical weight loss is contributing to the procedure's increasing popularity. Technical refinements have improved surgical outcomes and safety. Despite this, it remains a procedure with one of the highest morbidity and mortality risks in aesthetic plastic surgery. Methods: A review of abdominoplasty complications and best practices was performed in order to provide a succinct review of the most prevalent safety issues in abdominoplasty surgery. Proposal: In order to mitigate the risk of complications, risk stratification, patient selection, and using evidence-based techniques are essential. In the present study, the authors provide recommendations for approaching the most common safety considerations of this procedure. Conclusion: Appropriate patient selection, surgical technique and proper protocols, ensures surgeons control the modifiable risk factors that increase complications. Implementing nonpharmacologic and pharmacologic interventions reduce the risk of venous thromboembolism. Using evidence-based techniques tailored to the specific patient's anatomy ensures the vascular territories of the abdominoplasty flap are respected and perfusion for wound healing is optimized."
A,13,openalex,Aesthetic Plastic Surgery,A split-face study to evaluate the efficacy of a dissolving microneedle-encapsulated niacinamide skin patch for the reduction of facial hyperpigmentation,2022,10.14730/aaps.2022.00633,https://doi.org/10.14730/aaps.2022.00633,open_access_cc_by,2,lasers_energy_devices; skin_quality_peels,clinical_gateway_source; safety_floor; sales_education_support; timing_maintenance; structured_taxonomy_support,3,"Background This study aimed to evaluate the efficacy and safety of a dissolving microneedle (DMN)-encapsulated niacinamide skin patch to reduce facial hyperpigmentation.Methods A split-face study was conducted between April and June 2022 in 17 patients treated with a DMN-encapsulated niacinamide skin patch, which was applied only on the right side of the face, while the left face remained free of a pigmentation-improving agent. A topical moisturizer and physical sunscreen were applied on both sides of the face for 2 weeks. We compared both sides of the face 2 weeks after applying the skin patch using an automatic skin analysis device to investigate skin pigmentation. The melasma severity scores of both sides were evaluated before and 2 weeks after application.Results A significant difference in the epidermal pigmentation score between pre-treatment and 2 weeks after treatment was noted on the right side (P&lt;0.05), but not on the left side of the face (P&gt;0.05). A significant difference in the melanin score between pre-treatment and 2 weeks after treatment was noted on the right side (P&lt;0.05), but not on the left side (P&gt;0.05) of the face. There was no significant difference in the melasma severity score on either side of the face between pre-treatment and 2 weeks after treatment (P&gt;0.05).Conclusions The application of a DMN-encapsulated niacinamide skin patch to improve skin pigmentation may yield good outcomes and provide comfort to patients without any complications."
A,13,openalex,Aesthetic Plastic Surgery,Consensus on Current Injectable Treatment Strategies in the Asian Face,2016,10.1007/s00266-016-0608-y,https://doi.org/10.1007/s00266-016-0608-y,open_access_cc_by,2,dermal_fillers; injectables_neurotoxins,clinical_gateway_source; sales_education_support; combination_observation,76,"BACKGROUND: The desire for and use of nonsurgical injectable esthetic facial treatments are increasing in Asia. The structural and anatomical features specific to the Asian face, and differences from Western populations in facial aging, necessitate unique esthetic treatment strategies, but published recommendations and clinical evidence for injectable treatments in Asians are scarce. METHODS: The Asian Facial Aesthetics Expert Consensus Group met to discuss current practices and consensus opinions on the cosmetic use of botulinum toxin and hyaluronic acid (HA) fillers, alone and in combination, for facial applications in Southeastern and Eastern Asians. Consensus opinions and statements on treatment aims and current practice were developed following discussions regarding pre-meeting and meeting survey outcomes, peer-reviewed literature, and the experts' clinical experience. RESULTS: The indications and patterns of use of injectable treatments vary among patients of different ages, and among Asian countries. The combination use of botulinum toxin and fillers increases as patients age. Treatment aims in Asians and current practice regarding the use of botulinum toxin and HA fillers in the upper, middle, and lower face of patients aged 18 to[55 years are presented. CONCLUSIONS: In younger Asian patients, addressing proportion and structural features and deficiencies are important to achieve desired esthetic outcomes. In older patients, maintaining facial structure and volume and addressing lines and folds are essential to reduce the appearance of aging. This paper provides guidance on treatment strategies to address the complex esthetic requirements in Asian patients of all ages. LEVEL OF EVIDENCE V: This journal requires that the authors assign a level of evidence to each article. For a full description of these Evidence-Based Medicine ratings, please refer to the Table of Contents or the online Instructions to Authors www.springer.com/00266 ."
A,13,openalex,Aesthetic Plastic Surgery,Effectiveness and Safety of IPN-20-SENSE LIDOCAINE for Lip Volume Augmentation and/or Redefinition (SMILE Study): A Non-inferiority Randomized Double-Blinded Controlled Study,2024,10.1007/s00266-024-04398-z,https://doi.org/10.1007/s00266-024-04398-z,open_access_cc_by,2,dermal_fillers,clinical_gateway_source; safety_floor; sales_education_support; timing_maintenance; structured_taxonomy_support,3,"BACKGROUND: Hyaluronic acid (HA) is a widely used dermal filler for lip augmentation. IPN-20-SENSE LIDOCAINE (Laboratoires VIVACY) is a monophasic gel consisting of cross-linked HA and includes lidocaine hydrochloride for the reduction of injection-associated pain. AIMS: The SMILE study was designed to assess the non-inferiority of IPN-20-SENSE LIDOCAINE compared to HA-RK-Lido in improving aesthetic lip appearance. The secondary objectives were to evaluate the effectiveness and safety of IPN-20-SENSE LIDOCAINE against the chosen similar active control device. PATIENTS/METHODS: This was a prospective, multicenter, double-blinded, randomized active controlled parallel group study undertaken in two investigational sites between May 2021 and July 2022 (14 months). The primary endpoint of this study was the proportion of subjects reporting an improvement on the Global Aesthetic Improvement Scale (GAIS) 3 months after treatment initiation. RESULTS: Regarding the primary endpoint, the difference between the treatment arms in the proportion of improved subjects was +7.0 [-2.2; 17.7]. The lower limit of this 90% CI, being above the non-inferiority margin of -15 and below zero, demonstrated the non-inferiority of IPN-20-SENSE LIDOCAINE vs. HA-RK-Lido. The secondary outcomes reported by subjects and the blinded live evaluators supported this result. All injection site reactions and device-related adverse events reported in this study were expected, already described and were mostly mild and transient. CONCLUSIONS: The study demonstrated the non-inferiority of IPN-20-SENSE LIDOCAINE to HA-RK-Lido in the aesthetic improvement of the lips. The effect of both treatments decreased over time. Nonetheless, aesthetic improvement was sustained longer in the IPN-20-SENSE LIDOCAINE arm. LEVEL OF EVIDENCE I: This journal requires that authors assign a level of evidence to each article. For a full description of these Evidence-Based Medicine ratings, please refer to the Table of Contents or the online Instructions to Authors www.springer.com/00266 ."
