quality_tier,quality_score,discovery_source,registry_journal,title,year,doi,url,rights_class,authority_rank,topics,dossier_use_buckets,citation_count,abstract
A,12,openalex,Aesthetic Medicine,New Technique for Reducing and Modeling Nasolabial Fat and Jowls: Lipoestructuración,2023,10.51521/wjcam.2023.1101,http://doi.org/10.51521/wjcam.2023.1101,open_access_cc_by,4,body_contouring,clinical_gateway_source; safety_floor; sales_education_support; timing_maintenance; structured_taxonomy_support,0,"The aging process is characterized by ptosis of the fatty compartments of the face, loss of subcutaneous volume, weakening of the supporting structures of the face. In this process movement may occur, atrophy of the deep pads and hypertrophy of different superficial fat pads, for unknown causes, leaving the nasolabial fat prominent [3,4]. Currently, facial fat reduction can be performed by liposuction only in the submental and cervical regions [7]. Other minimally invasive treatments such as subcutaneous mesotherapy with deoxycholic acid or sodium deoxycholate associated with other active ingredients are being studied in aesthetic medicine to allow treatment of other areas of the face [2,4,6]. The development of new techniques is promising, such as the subcision of adipose tissue, already used in cellulite, is believed to allow the migration of fat cells in facial compartments to other compartments with lower volume, inducing an increase in adipose tissue in deficient compartments, and increases the stimulation of collagen evidenced in the treatment of acne scars [1,5]. As well as, the lack of standardization of mesotherapy techniques “chemical lipolysis” to reduce fat compartments. This prospective experimental clinical study was performed with 5 female patients. Clinical evidence was sought for the reduction of nasolabial fat compartments with modeling of facial fat and increase of self-esteem of patients with standardization of a new technique called lipostructure. Anthropometric measurements of the treated compartments and satisfaction research questionnaires of these patients will be used, as well as post-procedure follow-up to demonstrate the main adverse effects of this technique. The results found point to a mean reduction of 2.03% in the nasolabial fat of the patients studied (p ≤ 0.05), demonstrating its efficacy. The patient evaluation form 30 days after the procedure showed that 80% of the patients were satisfied (40% well satisfied and 40% very satisfied), demonstrating its efficiency"
A,12,openalex,Aesthetic Plastic Surgery,A split-face study evaluating the efficacy of a topical antioxidant cream containing tocotrienol after 1064-nm picosecond Nd:YAG laser treatment for environment-induced skin pigmentation,2021,10.14730/aaps.2021.00143,https://doi.org/10.14730/aaps.2021.00143,open_access_cc_by,2,lasers_energy_devices; skin_quality_peels,clinical_gateway_source; safety_floor; timing_maintenance,2,"Background This study aimed to evaluate the efficacy and safety of a topical antioxidant cream containing tocotrienol after 1064-nm picosecond neodymium-doped yttrium aluminum garnet (Nd:YAG) laser treatment for environment-induced skin pigmentation.Methods A split-face study was conducted between December 2020 and March 2021 in 26 patients (25 women and one man) who were treated with a 1064-nm picosecond Nd:YAG laser. On the right side of the face, an antioxidant cream containing tocotrienol was applied after picosecond laser treatment, and on the left side, only picosecond laser treatment was performed. We compared the right and left sides of the face at 4 weeks after laser treatment using an automatic skin analysis device to investigate skin pigmentation. The melasma severity scores of the two sides were evaluated before and 4 weeks after picosecond laser treatment.Results The skin pigmentation score showed a significant difference between pretreatment and 4 weeks after picosecond laser treatment on both sides of the face (P&lt;0.001), and there was a significant difference in skin pigmentation score improvement between the right and left sides (P&lt;0.001). The melasma severity score showed a significant difference on the right side between pretreatment and 4 weeks after laser treatment (P&lt;0.001), but there was no significant change on the left side (P&gt;0.05).Conclusions Our results show that, for the treatment of environment-induced skin pigmentation, the application of a tocotrienol-containing antioxidant cream after 1064-nm picosecond laser treatment can provide good results without any complications."
A,12,openalex,Aesthetic Plastic Surgery,Decreasing Venous Thromboembolism With Anticoagulation in Plastic Surgery,2025,10.1177/22925503251315490,https://doi.org/10.1177/22925503251315490,open_access_cc_by,2,glp1_aesthetics; medspa_general,clinical_gateway_source; safety_floor,2,"Introduction: Venous thromboembolism (VTE) is a devastating complication in aesthetic plastic surgery. Plastic surgeons are advised to approach VTE prevention proactively by modifying the perioperative risk profile of their patients. Herein, the authors review the evidence of pharmacologic prevention of VTE in plastic surgery, caution surgeons that blanket treatment based on Caprini score alone should be avoided, and advocate for case-by-case individualized therapy for every patient. Methods: A review of evidence for the pharmacologic prevention of VTE in plastic surgery was performed. Results/Conclusion: A proactive approach to VTE prevention can be achieved by employing both nonpharmacologic and pharmacologic evidence-based interventions. While the choice to use anticoagulation medications should be guided by calculation of a Caprini score for each patient, surgeons should continue to maintain their clinical judgment to prevent complications from over and under treatment."
A,12,openalex,Aesthetic Plastic Surgery,Evaluation of Micro-focused Ultrasound for Lifting and Tightening the Face,2015,10.14730/aaps.2015.21.2.65,https://doi.org/10.14730/aaps.2015.21.2.65,open_access_cc_by,2,rf_microneedling_ultrasound,clinical_gateway_source; safety_floor; timing_maintenance,9,"Background Micro-focused ultrasound (MFU) has developed as an effective, noninvasive, skin-tightening method. However, certain factors have limited its replacement of invasive surgical procedures, including a relative lack of efficacy, persistence, and reliability. The purpose of this study was to evaluate the efficacy and safety of MFU for noninvasive skin tightening and to determine how long the skin tightening can be maintained. Methods Between October 2013 and November 2014, 41 patients with sagging and laxity of the facial skin were treated with MFU. The treatment was performed following the manufacturer's recommended protocol that called for 300 treatment lines. We evaluated the patients using an automatic skin diagnosis system at pretreatment, and 2 and 4 months after treatment. Results Of the 41 patients treated using MFU, 3 patients were lost to follow-up for nonstudy-related reasons. In our study, 38 patients (1 male and 37 female) were evaluated and ranged in age from 37 to 52 years. The median skin grade scores were 5 at pretreatment, 3 at 2 months posttreatment and 3 at 4 months posttreatment. After comparing pretreatment and 2 months posttreatment, pretreatment and 4 months posttreatment, and both 2 and 4 months posttreatment, there were statistically significant differences (P<0.01). Conclusions This study suggests that the aging face, with wrinkling and sagging, can be improved using MFU, while minimizing injury to the epidermis and dermis."
A,12,openalex,Aesthetic Plastic Surgery,Subject-Reported Satisfaction After Cell-Enriched Lipotransfer (CELT) for Lip Augmentation,2025,10.1007/s00266-025-04875-z,https://doi.org/10.1007/s00266-025-04875-z,open_access_cc_by,2,dermal_fillers,clinical_gateway_source; sales_education_support; combination_observation; structured_taxonomy_support,1,"BACKGROUND: Lip augmentation is a highly demanded cosmetic procedure due to the association of full lips with youth, beauty, and sensuality. Among various techniques, autologous fat grafting, particularly with the cell-enriched lipotransfer (CELT) method, has emerged as a natural and long-lasting option. Unlike hyaluronic acid fillers, which require regular touch-ups, CELT offers sustained volume retention and potentially higher patient satisfaction. OBJECTIVE: This study aimed to assess patient satisfaction following lip augmentation using the CELT technique and compare it with traditional fat preparation methods, such as sedimentation and filtration. The study also sought to evaluate the influence of other variables, including gender, age, and fat injection volume, on satisfaction outcomes. MATERIALS AND METHODS: questionnaire, focusing on various lip-related aspects such as shape, fullness, and how well the lips suited the face. The study compared satisfaction outcomes between the CELT method and combined sedimentation/filtration techniques. Statistical analysis using the Kruskal-Wallis test and Pearson's correlation was performed to assess the influence of preparation method, injected volume, and patient demographics. RESULTS: The CELT method consistently produced higher satisfaction compared to sedimentation and filtration (p < 0.001 for all items). Patients treated with CELT reported greater improvements in the shape of the lips, fullness of the lower lip, and Cupid's bow. Gender and age were also significant factors, with males showing greater satisfaction in smile-related aspects, while females were more satisfied with the lip style. Older patients reported greater improvements in how well their lips suited their face, while higher injected volumes positively correlated with lip fullness and appearance. CONCLUSION: The CELT fat grafting technique significantly enhances patient satisfaction in lip augmentation compared to traditional fat preparation methods. CELT's higher fat retention and more natural results make it a superior option for lip augmentation. However, further studies incorporating objective volumetric measurements are needed to validate these findings. LEVEL OF EVIDENCE IV: This journal requires that authors assign a level of evidence to each article. For a full description of these Evidence-Based Medicine ratings, please refer to the Table of Contents or the online Instructions to Authors www.springer.com/00266 ."
A,12,openalex,Aesthetic Plastic Surgery,The Canadian Society for Aesthetic Plastic Surgery 40th Annual Meeting,2013,10.4172/plastic-surgery.1000829,http://doi.org/10.4172/plastic-surgery.1000829,open_access_cc_by,2,injectables_neurotoxins; regenerative_prp,clinical_gateway_source; safety_floor; timing_maintenance; structured_taxonomy_support,0,"After studying the anatomy of 10 fresh cadavers, we developed a technique for the treatment of the cervical area during face lifts. We called this technique PLATYSMA-SUSPENSION and PLATYSMA-PEXY rather than plication. This technique consists of suspending the free edge of the platysma muscle and fixing it to a resistant tissue close to the earlobe (Lor's fascia or temporo-parotid fascia). The anterior triangle of the neck was well defined and there was no need to undermine the platysma muscle because of a perfect sliding plane between the platysma and sternocleidomastoid muscles. This technique is both simple and effective. It generates long-lasting results, without the inconveniences or complications associated with other techniques. MATERIALS AND METHODS: Ten fresh cadavers (ie, 20 hemifaces) were subjected to the proposed technique. They were photographed and filmed at all stages. Ten more cadavers were dissected to study the submental area and we discovered that the best way to recreate the cervico mental angle and to rebuild the floor of the mouth is to use a digastric corset so that we could rebuild the retaining ligaments between the platysma/digastric and mylohyod muscles. More than 100 patients were operated by the senior author; they underwent platysma-suspension and platysma-pexy of the fascia described by Lor; associated in difficult necks (Knize 3 and 4 necks ) with the digastric corset. The patients were followed-up for a minimum of 12 months. CONCLUSION: PLATYSMA-SUSPENSION and PLATYSMA-PEXY in the fascia described by Lor is an extremely long-lasting and effective technique in cervical lifting. It generates impressive results, even in the most inferior portion of the neck. It redefines the entire anterior triangle, especially the sternocleidomastoid muscle and the mandibular contours. Furthermore, PLATYSMA-SUSPENSION minimizes the risk of nerve injury and hematoma by preventing deep and unnecessary dissections because the superficial cervical fascia has a perfect sliding plane between the platysma and the deepest structures of the neck. In difficult necks, we do associate a digastric corset using a submental incision. Pre-op botulinum toxin injections appears to be of great interest leaving the muscle at rest during the post-operative phase."
A,12,openalex,Aesthetic Plastic Surgery,The Efficacy of a Q-Switched 694-nm Ruby Fractional Laser for Treating Acquired Bilateral Nevus of Ota-Like Macules,2018,10.14730/aaps.2018.24.1.20,https://doi.org/10.14730/aaps.2018.24.1.20,open_access_cc_by,2,lasers_energy_devices; skin_quality_peels,clinical_gateway_source; safety_floor; structured_taxonomy_support,4,"Acquired bilateral nevus of Ota-like macules (ABNOM) are a common form of hyperpigmentation in Asian populations, character-ized by small, bilateral, blue-brown and/or slate-gray patches on the forehead, temples, eyelids, malar areas, and alae and roots of the nose [1]. As reported in other studies, several treatment modalities, including cryotherapy and dermabrasion, have been tried for ABNOM Based on the principles of selective photothermolysis, nevus of Ota has been successfully treated with Q-switched (QS) ruby lasers, QS alexandrite lasers, and QS neodymium-doped yttrium aluminium garnet lasers (QS-Nd:YAG) ABNOM and nevus of Ota, are histologically similar, which suggested to us that laser therapy may also be successful for treating ABNOM. We therefore assessed the efficacy and complications of a fractional QS ruby laser (QSRL) in the treatment of ABNOM. The purpose of this study was to evaluate the efficacy and complications of QSRL in the treatment of ABNOM."
A,12,crossref,Aesthetic Surgery Journal Open Forum,A Comprehensive Ultrasound Evaluation Approach of Lower Facial Structure Before Masseter Muscle Botulinum Toxin Injection,2023,10.1093/asj/sjac336,https://doi.org/10.1093/asj/sjac336,open_access_cc_by,2,injectables_neurotoxins; rf_microneedling_ultrasound,clinical_gateway_source; safety_floor; structured_taxonomy_support,7,"Abstract Background Masseter reduction by botulinum neurotoxin A (BoNT-A) injection is a popular procedure in East Asia. Inappropriate injection can result in various complications. Objectives The aim of this study was to develop an approach for comprehensively evaluating the lower facial structure based on the shape of the mandible angle, the thickness of the masseter, and the thickness of subcutaneous fat. Methods Clinical profiles and standard ultrasound images were collected from patients seeking masseter BoNT-A injections. Lower facial structures were evaluated based on 3 aspects: mandible, masseter, and subcutaneous fat and skin. The mandibular angle was classified as extroverted, straight, or introverted. The starting point of the middle part of the masseter was recorded. The thickness of the deep inferior tendon, the superficial and deep belly of the superficial part of the masseter, and their contractility were measured. Overall thickness and the thickness of subcutaneous fat and skin were also measured. Results Eighty-four masseters from 42 patients were included. Straight mandibular angles were the most common type of angle (48.81%), followed by introverted (26.19%) and extroverted angles (25.00%). The middle part of the masseter starts from 2.33 [0.36] cm (mean [standard deviation]) above the mandible edge, which is above the usual injection points. The superficial belly was thicker than the deep belly in both static and clenching states (P = .048, P = .001) and had greater contractility. The average overall thickness was 1.87 [0.29] cm. Conclusions Comprehensive evaluation of the lower facial contour and structure based on ultrasound examination could be a reliable and replicable assessment approach. Level of Evidence: 4"
A,12,crossref,Aesthetic Surgery Journal Open Forum,Abdominoplasty in the Massive Weight Loss Patient: Are Aesthetic Goals and Safety Mutually Exclusive?,2021,10.1093/asjof/ojab013,https://doi.org/10.1093/asjof/ojab013,open_access_cc_by,2,glp1_aesthetics; lasers_energy_devices; skin_quality_peels,clinical_gateway_source; safety_floor,10,"Abstract Background The goals of abdominoplasty in massive weight loss (MWL) patients are often functional, with a greater emphasis on safety than on aesthetic rejuvenation. As important as functional improvements and safety are, however, there may be room for increasing the aesthetic potential of abdominoplasties in these patients. Objectives To determine the safety of the pursuit of aesthetic goals for abdominoplasty in MWL patients. Methods This is a retrospective study examining 910 consecutive female patients consisting of 3 groups: postpartum (n = 718), dietary MWL (n = 65), and bariatric MWL (n = 127). All patients were approached with a well-defined set of aesthetic goals which were pursued as needed and as feasible. Results The utilization of aesthetic abdominoplasty components was similar in all groups, supporting the assertion that the groups were subjected to a similar aesthetic emphasis. Logistic regression showed that a history of bariatric MWL was an independent risk factor for multiple complications (odds ratio 2.738, P = 0.014) and that elevated body mass index (BMI), smoking, diabetes, and age were likewise independent risk factors for complications. Propensity score-matched case-control pairs showed that bariatric MWL patients were more likely than dietary MWL patients to experience multiple complications (9.52% vs 0%, P = 0.031). Conclusions Bariatric MWL patients but not dietary weight loss patients seem to have a higher risk than postpartum patients. Other comorbidities (elevated BMI, smoking, diabetes, and age) seem to be more important predictors of complications than MWL status. Select MWL patients can likely be approached with an emphasis on aesthetic goals, without increasing risks as compared with the postpartum population. Level of Evidence: 2"
A,12,crossref,Aesthetic Surgery Journal Open Forum,An Analysis of Safety Data from Five Phase III Clinical Trials on the Use of Botulinum Neurotoxin Type A-ABO for the Treatment of Glabellar Lines,2009,10.1016/j.asj.2009.09.010,https://doi.org/10.1016/j.asj.2009.09.010,open_access_cc_by,2,injectables_neurotoxins,clinical_gateway_source; safety_floor; structured_taxonomy_support,14,
A,12,crossref,Aesthetic Surgery Journal Open Forum,An Analysis of the Long-Term Safety Data of Repeat Administrations of Botulinum Neurotoxin Type A-ABO for the Treatment of Glabellar Lines,2009,10.1016/j.asj.2009.09.003,https://doi.org/10.1016/j.asj.2009.09.003,open_access_cc_by,2,injectables_neurotoxins,clinical_gateway_source; safety_floor; timing_maintenance; structured_taxonomy_support,21,
A,12,crossref,Aesthetic Surgery Journal Open Forum,Botulinum Toxin Injection Technique for Reducing the Masseter Size and Enhancing the Jawline,2024,10.1093/asj/sjae062,https://doi.org/10.1093/asj/sjae062,open_access_cc_by,2,injectables_neurotoxins,clinical_gateway_source; safety_floor; timing_maintenance; structured_taxonomy_support,4,"Abstract Background The injection of botulinum toxin into the masseter muscle is an important method for improving hypertrophy. However, some patients may experience adverse reactions, such as sagging of the lower jaw. Therefore, we proposed a method of injecting botulinum toxin into the masseter and platysma muscles that would reduce masseter size and enhance the jawline. Objectives The aim of this study was to reduce the masseter size while enhancing the jawline. Methods Twenty patients received botulinum toxin injections into the masseter and platysma muscles. Pain levels were evaluated with the visual analog scale. All patients were photographed before and 6 months after treatment. Evaluations were performed based on standardized criteria. The lift index, reduction index, and symmetry index were performed to assess the degree of jawline elevation, masseter size reduction, and jawline symmetry before and after treatment. Results The mean visual analog scale score of the 20 patients was 2.80 (±1.24). The mean lift index score decreased from 4.93 (±0.34) to 4.53 (±0.37), P &lt; .05. The mean reduction index score decreased from 3.13 (±0.27) to 2.74 (±0.27), P &lt; .05. The mean symmetry index score changed from 0.0393 (±0.0296) to 0.0257 (±0.0246), P &lt; .05. Conclusions Botulinum toxin injections into the masseter and platysma muscles through nerve block reduced the masseter size, elevated the jawline, and improved symmetry. Level of Evidence: 4"
A,12,crossref,Aesthetic Surgery Journal Open Forum,Commentary on: Heterogeneity in Body Contouring Outcomes Based Research: The Pittsburgh Body Contouring Complication Reporting System,2018,10.1093/asj/sjx111,https://doi.org/10.1093/asj/sjx111,open_access_cc_by,2,body_contouring,clinical_gateway_source; safety_floor; sales_education_support,0,
